facility_name,website,pricing_found,pricing_page_url,phone_found,email_found,status
新山温馨疗养别墅EHA Golfview Eldercare Mansion (Johor Jaya) #1 Nursing Home Johor Bahru,https://ehaeldercare.com.my/,"RM 1,500 / Month | RM 1,500 | RM 1,300 | RM 2,300 / Month | RM 3,200 / Month | RM 1,300 / Month",,+6019-728 3697,ask.ehagroup@gmail.com,ok
Rebina House Care Centre,https://www.rebinasunrise.com/,,,012 - 708 9777,care@rebinasunrise.com,ok
EHA Lakeview Eldercare Mansion - 新山湖畔疗养别墅 (Permas Branch) #1 Nursing Home Johor Bahru,https://ehaeldercare.com.my/,"RM 1,500 / Month | RM 1,500 | RM 1,300 | RM 2,300 / Month | RM 3,200 / Month | RM 1,300 / Month",,+6019-728 3697,ask.ehagroup@gmail.com,ok
EHA Parkview ElderCare (Perling) 新山温馨疗养院 #1 Nursing Home Johor Bahru,https://ehaeldercare.com.my/,"RM 1,500 / Month | RM 1,500 | RM 1,300 | RM 2,300 / Month | RM 3,200 / Month | RM 1,300 / Month",,+6019-728 3697,ask.ehagroup@gmail.com,ok
Nursing Home Johor Bahru | Loving Mansion Care Centre,https://lovingmansion.com/%3Futm_source%3Dgmb%26utm_medium%3Dreferral,,,,,HTTP 404
ECON Medicare Centre & Nursing Home - Taman Perling Branch 宜康医疗保健中心与疗养院 - 柏伶分行,https://www.facebook.com/econperling/,,,,,HTTP 400
Spring Valley HomeCare (Nursing Home),https://www.springvalleyhomecare.com.my/,,,,springvalley.homecare@gmail.com,ok
Woon Ho Family Care Centre,https://woonhofamilycarecentre.com.my/,,,+60199522567,woonho.familycare@gmail.com,ok
FCC Family Care Centre Johor Bahru,http://familycarecentre.co/,"RM 450-RM 600 | RM 3,800 | RM 4,300 | RM 3,800 / month | RM 3,500 / month | RM 200",https://www.familycarecentre.co/services/,,,ok
Multicare Nursing Home Johor,https://www.multicarehomes.com/,RM 2500 | RM 3000 | RM 2000 | RM 2800 | RM 1800 | RM 2300,https://www.multicarehomes.com/packages.html,+6012 650 1805,info@multicarehomes.com,ok
Anzaletta Living Care Centre | Old Age Home in Johor Bahru | Aged Care Service | Nursing Home,https://anzalettacarecentre.com/,,,010-664 2170,philomenadavis63@gmail.com,ok
Genesis Life Care Centre JB,https://genesiscare.com.my/nursing-home-in-johor-bahru/,"rm,",,+6019-282-0457,enquiries@genesiscare.com.my,ok
PRESTIGE RESIDENCE CARE (GROUP) SDN BHD,http://www.prestigecare.com.my/,,,,,ok
Evergreen ElderCare Centre EECMSIA,http://www.eecmsia.com/,,,,,ok
Jeta Care nursing home,http://www.jetacare.com/,"rm,",,+60187695688,enquiry@jetacare.com,ok
EHA Sunview ElderCare (Kempas) 新山温馨疗养别墅 #1 Nursing Home Johor Bahru,https://ehaeldercare.com.my/,"RM 1,500 / Month | RM 1,500 | RM 1,300 | RM 2,300 / Month | RM 3,200 / Month | RM 1,300 / Month",,+6019-728 3697,ask.ehagroup@gmail.com,ok
居銮疗养院 -EHA Elder Care Home (Kluang) 温馨老家 -Licensed and Certified by Government,https://ehaeldercare.com.my/,"RM 1,500 / Month | RM 1,500 | RM 1,300 | RM 2,300 / Month | RM 3,200 / Month | RM 1,300 / Month",,+6019-728 3697,ask.ehagroup@gmail.com,ok
Gentle Hill Elder Care,http://gentlehill.my/,,,+607-818 0388,enquiry@gentlehill.my,ok
Tila Care Centre,https://g.page/tila-care-centre,,,,,ok
EHA Bayview Eldercare - (Cheras | Sungai Long | Kajang) 温馨疗养别墅 #1 Nursing Home KL,http://ehaeldercare.com.my/,"RM 1,500 / Month | RM 1,500 | RM 1,300 | RM 2,300 / Month | RM 3,200 / Month | RM 1,300 / Month",,+6019-728 3697,ask.ehagroup@gmail.com,ok
Noble Care,http://www.mynoblecare.com/,"rm,",https://mynoblecare.com/services/senior-citizens-care/,01001020128,,ok
Green Acres Elderly Care Centre Managed By Green Acres Residence Care (Group) Sdn. Bhd.,https://www.greenacreshome.com/,,,,,ok
Lee Nursing 李护理疗养院,http://www.facebook.com/Lee-Nursing-Home-101030911675780,,,,,HTTP 400
Lotus Ville Care Centre,https://lotusville.org.my/,,,,,connection_error
"Yong An Old Folks Care Centre - Ulu Tiram, JB",https://yongan-evercare.com/,"RM2,400/month | RM2,400 | RM2,700/month | RM2,700",,+6010-2222566,,ok
AustinLoyal Care Centre,http://www.austinloyal.com/,,,,,ok
JR Segamat Care Centre,https://johnsonresidence.com.my/,"rm,",https://johnsonresidence.com.my/contact-us/,,,ok
Golden Age Care Centre,https://www.facebook.com/goldenagecc,,,,,HTTP 400
EHA Grandview Eldercare - 甲洞温馨疗养别墅 #1 Nursing Home KL (Kepong | Desa Parkcity | Jalan Ipoh ),https://ehaeldercare.com.my/,"RM 1,500 / Month | RM 1,500 | RM 1,300 | RM 2,300 / Month | RM 3,200 / Month | RM 1,300 / Month",,+6019-728 3697,ask.ehagroup@gmail.com,ok
Gentle Hearts Care Centre 温心疗养与护理中心,https://www.gentlehearts.my/,"rm,",,+606 - 379 6559,info@gentlehearts.my,ok
Cozzi Confinement Center | Yong Peng 娘家精致月子中心,https://cozziconfinement.com.my/,,,02301017662,,ok
Haywood Senior Living Medini Johor Bahru,https://haywoodliving.co/,"rm,",https://haywoodliving.co/about-us/,026-2027,,ok
GOLDEN AGE CARE CENTRE TANGKAK,https://gacc.com.my/,"rm,",,06-9527711,goldenagecc@gmail.com,ok
Summer Eldercare Johor Bahru,https://summereldercare.my.canva.site/,,,,,ok
Master Nursing Care Centre @Daya,https://www.facebook.com/carecentrejbmsia/,,,,,HTTP 400
"Hibiscus Serenity Care Centre || 疗养院 Nursing Home in Larkin, Johor Bahru (JB)",https://www.hibiscus-care.com/,00 per month | RM 20,https://www.hibiscus-care.com/our-services,,,ok
Sunrise Care Centre Sdn Bhd,https://www.rebinasunrise.com/,,,012 - 708 9777,care@rebinasunrise.com,ok
AX Nursing Home PLT,https://web.facebook.com/axnursinghome,,,,,HTTP 400
Pusat Perjagaan Orang Tua Ren Ai 仁愛安老院,https://www.facebook.com/RenAiSenai/,,,,,HTTP 400
Fu Ka Care Center,https://web.facebook.com/fukacarecenter,,,,,HTTP 400
Pusat Jagaan Orang Tua Yeo JB,https://www.facebook.com/gracehome.yeo,,,,,HTTP 400
Pusat Jagaan Warga Emas Nur Ehsan,https://m.facebook.com/pages/category/Public-Service/Pusat-Jagaan-Warga-Emas-Nur-Ehsan-1051759248276730/,,,,,HTTP 400
Green Acres Home Care Centre- Managed By Green Acres Residence Care (Group) Sdn. Bhd.,https://www.greenacreshome.com/,,,,,ok
Ummi Naura Care Centre,http://umminauracarecentre.wordpress.com/,,,013-9796861,,ok
麻坡养心院,https://www.facebook.com/share/13nx3m6WB9/%3Fmibextid%3DLQQJ4d,,,,,HTTP 404
Elders Home Care Centre,http://www.eldershome.com.my/,,,,,ok
Cozzi Confinement Center | Muar 娘家精致月子中心,https://cozziconfinement.com.my/,,,02301017662,,ok
Gold Care Nursing Home Centre,http://goldcarenursinghome.com/,RM60,,,,ok
BIGTREE Medicare & Nursing Home,https://www.bigtree.care/,,,+6012 685 5103,info@bigtree.care,ok
Mintygreen Premium Nursing & Rehabilitation (Relau),https://www.mintygreen-wellness.com/,RM 40 | RM 220,https://www.mintygreen-wellness.com/services,0384081978,hr@mintygreen-wellness.com,ok
Healthlife Old Folks Home,http://www.aixinliauyang.yolasite.com/https://www.facebook.com/AiXinLiaoYangZhongXin,,,,,HTTP 404
Golden Age Care Centre Batu Pahat,https://www.gacc.com.my/index,"rm,",,06-9527711,goldenagecc@gmail.com,ok
Pusat Jagaan Wargatua Parit Bilal,https://www.facebook.com/profile.php%3Fid%3D100063647223251,,,,,HTTP 400
Cozzi Confinement Center | Sri Jaya 娘家精致月子中心,https://cozziconfinement.com.my/,,,02301017662,,ok
Cozzi Confinement Center | Tanah Merah 娘家精致月子中心,https://cozziconfinement.com.my/,,,02301017662,,ok
Pearl Care Centre Group Sdn Bhd Nursing Home Penang,https://pearlcarecentre.com/,,,0165559067,gunasegaran@pearlcarecentre.com,ok
My Aged Care Nursing Home in PJ Old Town,http://www.myagedcare.com.my/,"rm,",,+6017-851 7500,,ok
Pusat Jagaan Impian Syimah (Jalan Kemaman),https://www.facebook.com/PusatJagaanImpianSyimah,,,,,HTTP 400
Pusat Jagaan Impian Syimah (Jalan Kemuncak),https://www.facebook.com/PusatJagaanImpianSyimah,,,,,HTTP 400
安心养老院 Elderia Care Center,https://elderiacare.wixsite.com/elderia-care-center,,,011-2803 0620,Elderiacare@gmail.com,ok
Elim Nursing Home Batu Pahat 疗养院,https://www.facebook.com/elimnursinghomebp,,,,,HTTP 400
涵·疗养院 Hang Nursing Home (Gelang Patah Branch),https://m.facebook.com/pusatjagaanhang/,,,,,HTTP 400
Green Garden Care Center Sdn Bhd,http://www.greengarden.com.my/,,,07-686 9800,sales@greengarden.com.my,ok
Amitabha Foundation (Amitabha Malaysia),https://en.amitabhamalaysia.org/,,,607-213 2448,,ok
KNK HOMECARE LAGENDA HEIGHTS,http://www.atri.com.my/,,,02101034424,atrimedicalmanagement@gmail.com,ok
ReU Living (Post Surgery and Recovery Care Centre),http://reuliving.com/,,,+6010 3800 938,info@reuliving.com,ok
"Rumah Orang Tua, Mahligai Kasih Juju(MKJ) - Bukit Baru, Melaka (Rumah Orang Tua Melaka)",https://www.mahligaikasihjuju.com/,,,012-237 0093,mahligaikasihjuju@gmail.com,ok
MultiCare Nursing Home,https://www.multicarehomes.com/,RM 2500 | RM 3000 | RM 2000 | RM 2800 | RM 1800 | RM 2300,https://www.multicarehomes.com/packages.html,+6012 650 1805,info@multicarehomes.com,ok
KNK HOMECARE TAMAN PETANI JAYA,http://www.atri.com.my/,,,02101034424,atrimedicalmanagement@gmail.com,ok
Attia Nursing Care Centre PJ,http://www.attianursingcare.com/,,,,,ok
Yang Xin Nursing Home (养心托管安老院),https://www.facebook.com/profile.php%3Fid%3D100084633097437%26locale%3Dzh_CN,,,,,HTTP 400
JETA CARE SDN. BHD,http://www.jetacare.com/,"rm,",,+60187695688,enquiry@jetacare.com,ok
